<?xml version="1.0" encoding="UTF-8"?>
<md:menuDefinition 
   xmlns:xsi="http://www.w3.org/2001/XMLSchema-instance" 
   xmlns:pp="http://www.processpuzzle.com" 
   xmlns:md="http://www.processpuzzle.com/MenuDefinition"
   xsi:schemaLocation="http://www.processpuzzle.com/MenuDefinition http://processpuzzle.com/Schemas/MenuDefinition.xsd">
	
	<md:menuItem menuItemId="MenuWidget">
      <md:menuItem menuItemId="YourMenu" caption="WebUIMenu.documentExamples" isDefault="true">
               
         <md:menuItem menuItemId="YourMenu-Html" caption="WebUIMenu.documentExamples.htmlContent" isDefault="true">
            <pp:messageProperties>{ activityType : AbstractDocument.Activity.LOAD_DOCUMENT, documentURI : 'Content/HtmlDocument.xml', documentType : AbstractDocument.Types.HTML }</pp:messageProperties>         
         </md:menuItem>       
               
         <md:menuItem menuItemId="YourMenu-Static" caption="WebUIMenu.documentExamples.staticDocument" isDefault="false">
            <pp:messageProperties>{ activityType : AbstractDocument.Activity.LOAD_DOCUMENT, documentURI : 'Content/StaticDocument.xml', documentType : AbstractDocument.Types.SMART }</pp:messageProperties>         
         </md:menuItem>       
               
         <md:menuItem menuItemId="YourMenu-Dynamic" caption="WebUIMenu.documentExamples.dynamicDocument" isDefault="false">
            <pp:messageProperties>{ activityType : AbstractDocument.Activity.LOAD_DOCUMENT, documentURI : 'Content/DynamicDocument.xml', documentContentURI : 'Content/DynamicContent', documentType : AbstractDocument.Types.SMART }</pp:messageProperties>         
         </md:menuItem>
         
         <md:menuItem menuItemId="YourMenu-PhotoAlbum" caption="WebUIMenu.documentExamples.photoAlbum" isDefault="false">
            <pp:messageProperties>{ activityType : AbstractDocument.Activity.LOAD_DOCUMENT, documentURI : 'Content/PhotoGaleryDocument.xml', documentType : AbstractDocument.Types.SMART }</pp:messageProperties>         
         </md:menuItem>
         
         <md:menuItem menuItemId="YourMenu-VideoAlbum" caption="WebUIMenu.documentExamples.videoAlbum" isDefault="false">
            <pp:messageProperties>{ activityType : AbstractDocument.Activity.LOAD_DOCUMENT, documentURI : 'Content/VideoGaleryDocument.xml', documentType : AbstractDocument.Types.SMART }</pp:messageProperties>         
         </md:menuItem>       
         
         <md:menuItem menuItemId="YourMenu-Diagram" caption="WebUIMenu.documentExamples.diagram" isDefault="false">
            <pp:messageProperties>{ activityType : AbstractDocument.Activity.LOAD_DOCUMENT, documentURI : 'Content/WidgetExamples/DiagramDocument.xml', documentType : AbstractDocument.Types.SMART }</pp:messageProperties>         
         </md:menuItem>
      </md:menuItem>
      
      <md:menuItem menuItemId="Widgets" caption="WebUIMenu.widgets">
               
         <md:menuItem menuItemId="Widgets-HierachicalMenuWidget" caption="WebUIMenu.widgets.menuWidget" isDefault="true">
            <pp:messageProperties>{ activityType : AbstractDocument.Activity.LOAD_DOCUMENT, documentURI : 'Content/WidgetExamples/HierarchicalMenuWidgetDocument.xml', documentType : AbstractDocument.Types.SMART }</pp:messageProperties>         
         </md:menuItem>
               
         <md:menuItem menuItemId="Widgets-NewsReader" caption="WebUIMenu.widgets.newsReader" isDefault="false">
            <pp:messageProperties>{ activityType : AbstractDocument.Activity.LOAD_DOCUMENT, documentURI : 'Content/WidgetExamples/DiagramDocument.xml', documentType : AbstractDocument.Types.SMART }</pp:messageProperties>         
         </md:menuItem>
                  
         <md:menuItem menuItemId="Widgets-Event" caption="WebUIMenu.widgets.eventsReader">
            <pp:messageProperties>{ activityType : AbstractDocument.Activity.LOAD_DOCUMENT, documentURI : 'Content/WidgetExamples/DiagramDocument.xml', documentType : AbstractDocument.Types.SMART }</pp:messageProperties>         
         </md:menuItem>
                  
         <md:menuItem menuItemId="Widgets-Tree" caption="WebUIMenu.widgets.treeView">
            <pp:messageProperties>{ activityType : AbstractDocument.Activity.LOAD_DOCUMENT, documentURI : 'Content/WidgetExamples/TreeDocument.xml', documentType : AbstractDocument.Types.SMART }</pp:messageProperties>         
         </md:menuItem>
      </md:menuItem>
	</md:menuItem>
</md:menuDefinition>